{
  "v": 1,
  "head_sha": "906a747",
  "candidates": [
    {
      "finder": "correctness",
      "defect_class": "logic",
      "path": "src/api/client.ts",
      "line": 88,
      "symbol": "earlyReturn",
      "claim": "an early return may skip the audit log write",
      "bad_outcome": "the audit log silently drops entries",
      "evidence": [
        "src/api/client.ts:88"
      ],
      "verify_by": "trace the early-return branch",
      "verdict": "confirmed",
      "R": 92,
      "A": 90,
      "Ac": 91,
      "final": 91,
      "severity": "high",
      "prefix": "issue",
      "blocking": true,
      "title": "Early return may skip the audit log write",
      "body": "This early-return may skip the audit log write.",
      "materiality": true,
      "category": "correctness"
    }
  ],
  "gates": {
    "gate1": {
      "status": "PASS",
      "details": "The description matches what the diff does."
    },
    "gate4": {
      "precandidate_dispositions": [],
      "ai_stub_findings": []
    },
    "gate5": {
      "status": "PASS",
      "details": "The change is documented well enough to follow."
    }
  },
  "threads": [
    {
      "thread_id": "t1",
      "classification": "fixed",
      "reply": "Fixed in 906a747 — applyScalarFilter now rejects array values with a 400."
    }
  ],
  "memory": {
    "relevance_rules": [],
    "lessons_used": []
  },
  "lenses": {
    "optimality_cards": [
      {
        "path": "src/api/client.ts",
        "line": 180,
        "verdict": "suboptimal",
        "analysis_confidence": 88,
        "card_body": "> **Reuse `withRetry()` instead of hand-rolling a retry loop**\n\n**Why it's better** · _codebase-fit_ — one backoff policy instead of four."
      }
    ],
    "optimality_log": "ran · 1 judged · 0 optimal · 1 proposal(s) · 0 inline pointer(s) · 0 withheld",
    "standards_log": "ran · 1 docs · 0 finding(s)",
    "measurability_log": "ran · 1 paths classified · 0 missing · 0 unlinked",
    "holistic_log": "skipped"
  },
  "summary": "Fixes the audit-log early return and hardens applyScalarFilter against array inputs."
}