{
  "v": 1,
  "head_sha": "a1b2c3d4e5f6",
  "candidates": [
    {
      "finder": "correctness",
      "defect_class": "nil-deref",
      "path": "src/lib/widget.ts",
      "line": 42,
      "symbol": "renderWidget",
      "claim": "renderWidget dereferences props.config without a null check",
      "bad_outcome": "a caller passing no config throws at render time",
      "evidence": [
        "props.config.theme is read on line 42 with no guard above it"
      ],
      "severity_hint": "high",
      "fix": "guard with `props.config?.theme ?? DEFAULT_THEME`",
      "verify_by": "call renderWidget with config: undefined and observe the throw",
      "verdict": "confirmed",
      "R": 90,
      "A": 85,
      "Ac": 80,
      "final": 85.5,
      "severity": "high",
      "prefix": "issue",
      "blocking": true,
      "title": "Unguarded props.config dereference",
      "body": "`renderWidget` reads `props.config.theme` with no null check, so any caller that omits `config` throws at render time.",
      "fence": {
        "lang": "ts",
        "code": "const theme = props.config?.theme ?? DEFAULT_THEME;"
      },
      "materiality": true,
      "category": "null-safety"
    },
    {
      "finder": "quality",
      "defect_class": "naming",
      "path": "src/lib/widget.ts",
      "line": 12,
      "claim": "the local variable `x` shadows the outer `x` import",
      "bad_outcome": "a future edit inside this scope may read the wrong `x`",
      "evidence": [
        "`import { x } from './constants'` at line 3; `const x = computeLocal()` at line 12"
      ],
      "verify_by": "rename the local and confirm no call site relied on the shadowed identifier",
      "verdict": "confirmed",
      "R": 70,
      "A": 60,
      "Ac": 55,
      "final": 62.5,
      "severity": "low",
      "prefix": "nitpick",
      "blocking": false,
      "body": "`x` at line 12 shadows the `x` imported at line 3 \u2014 consider a more specific name.",
      "materiality": true,
      "category": "naming-nits"
    },
    {
      "finder": "dependency",
      "defect_class": "dep-breaking-change",
      "path": "package.json",
      "line": 8,
      "symbol": "left-pad",
      "claim": "left-pad was bumped across a major version with a documented breaking change to its default export",
      "bad_outcome": "consumers of the default export may receive undefined at runtime",
      "evidence": [
        "lockfile resolves left-pad to 3.0.0, up from 2.4.1"
      ],
      "verify_by": "check every usage_site against the changelog's documented break",
      "verdict": "unobtainable",
      "R": 40,
      "A": 30,
      "Ac": 20,
      "final": 31,
      "severity": "medium",
      "prefix": "suggestion",
      "blocking": false,
      "title": "left-pad major bump: changelog unreachable",
      "body": "left-pad's upstream changelog for 3.0.0 could not be fetched (network unreachable from this context), so the documented break could not be checked against this repo's own usage sites.",
      "materiality": true,
      "category": "dependency-verification",
      "unverified_reason": "upstream changelog host unreachable"
    }
  ],
  "gates": {
    "gate1": {
      "status": "PASS",
      "details": "PR description accurately reflects the diff's scope."
    },
    "gate5": {
      "status": "PASS",
      "details": "CLAUDE.md and the touched rule files were updated alongside the code change."
    },
    "gate4": {
      "precandidate_dispositions": [
        {
          "file": "src/lib/widget.ts",
          "line": 7,
          "category": "debug-leftover",
          "disposition": "exempt",
          "reason": "this `console.log` lives inside a markdown code fence in a doc comment, not executable code"
        },
        {
          "file": "src/lib/widget.ts",
          "line": 55,
          "category": "secret",
          "disposition": "confirm",
          "reason": "a hardcoded API key literal was added on this line"
        }
      ],
      "ai_stub_findings": []
    }
  },
  "threads": [
    {
      "thread_id": "PRRT_kwABC123",
      "classification": "declined",
      "reply": "Left as-is \u2014 the suggested rename would collide with the public API surface documented in README.md."
    },
    {
      "thread_id": "PRRT_kwXYZ789",
      "classification": "unaddressed"
    }
  ],
  "lenses": {
    "optimality_cards": [],
    "optimality_log": "skipped \u2014 no approach-level change in this diff",
    "standards_log": "ran \u2014 no findings against CLAUDE.md or .claude/rules/*.md",
    "measurability_log": "skipped \u2014 no web/mobile/api/worker path with new observable behaviour",
    "holistic_log": "ran \u2014 no cross-file intent mismatches found"
  },
  "summary": "One blocking null-deref fix needed; one nitpick; one dependency bump flagged as unverifiable due to a network error.",
  "memory": {
    "relevance_rules": [],
    "lessons_used": []
  }
}
